{
  "target": "sine_440hz",
  "status": "ok",
  "status_detail": null,
  "voiced_frame_ratio": 1.0,
  "harmonic_amplitude_motion": {
    "value": null,
    "missing_reason": "倍音振幅比の変動を算出できる倍音次数が1つもない（有声フレーム不足、または2次以降の倍音の平均振幅比が0.01未満でノイズフロアと区別できない）"
  },
  "non_integer_partial_ratio": {
    "value": 0.0005968076500569629,
    "missing_reason": null
  },
  "calc_conditions": {
    "schema_version": "1.0.0",
    "n_harmonics": 8,
    "harmonic_search_bins": 2,
    "no_pitch_voiced_ratio_threshold": 0.15,
    "min_relative_harmonic_amplitude": 0.01,
    "f0_estimation": {
      "name": "pyin",
      "version": "0.11.0",
      "fmin_hz": 60.0,
      "fmax_hz": 1000.0,
      "frame_length": 2048,
      "hop_length": 256
    }
  }
}
